Clothing ID,Age,Title,Review Text,Rating,Recommended IND,Positive Feedback Count,Division Name,Department Name,Class Name
937,39,Stinky sweater!,"Yikes!  quite a smell off of this one- like wet/hot wool.  the color was beautiful, but the sweater is enormous!  strange fit under the arms as well.  this one went back the same day.",1,0,0,General,Tops,Sweaters
1087,62,Perfer beige over pink,"I had tried this on in the beige & loved it but could not find it in my size so i got it in the pink.
did not look at good as the beige.",3,0,0,General,Dresses,Dresses
1087,43,So very disappointed,"I love retailer and fell in love as soon as i saw this dress online. being 5'10"" i love a quality maxi dress and this one did not disappoint. however, being 5'10"" also means the top sweater overlay hits me way short. it looks ridiculous. i also thought that this was very heavy for a maxi dress and could not imagine wearing it in 80 degree weather. unfortunately after waiting so long for it's arrival this is going back.",2,0,2,General,Dresses,Dresses
937,37,Scratchy,"The sweater is cute, but scratchy.",3,0,1,General,Tops,Sweaters
937,49,"Cute, but didnt love",It was cute. i didn't keep it because it wasn't soft and hung a bit different than pictured. i thought it would be softer material. it was itchy,3,0,0,General,Tops,Sweaters
1087,36,Gorgeous on the hanger but not for me,"I was so in love with this dress when i saw it in the store but so disappointed when i put it on. i am 5'10"" with curves and usually buy a large in dresses. this dress looked like a sack on me. the top was way too big and loose making the dress a boxy cut rather than a maxi cut like i was expecting. the dress is lovely to look at on the hanger and feels good on but i don't think it flatters hourglass figures. it was the right length for me unlike many other reviewers. 
obviously, based off the",3,0,2,General,Dresses,Dresses
937,46,Primula cocoon cardi,"This is huge. i understand that's the style, but it looked like i was wearing my husband's size xxl. i tried to imagine a really cold day when all that extra fabric would be nice... but then it started to itch, and itch and itch!",2,0,4,General,Tops,Sweaters
937,32,Not for me,The fit is not as shown on the website. will be returning.,1,0,0,General,Tops,Sweaters
1087,38,Awful if you have any sort of curves!,"I am floored by the amount of positive reviews on this dress! when i received it, it looked nothing like it does on the model. the bottom looked like dirty sand and was completely wrinkled. if you have anything above a c cup, the top looks completely unflattering. i looked so top heavy in this dress! definitely not worth the price. so disappointed.",2,0,2,General,Dresses,Dresses
1110,35,Armholes huge,"This didn't work for me. im normally a m (8/10). got this in xs. that was the correct size for me, i believe. however, the armholes were huge. husband said the top of the dress looked like the autobots symbol from transformers and he wanted me to keep it. but, i sent it back.",2,0,0,General Petite,Dresses,Dresses
1072,56,No slip and totally sheer dress,"I just received this in the mail today. first of all there was no slip included and the fabric is totally sheer. the description says ""viscose lining"" so i assume there was a slip and from the picture it looks like it was a beige color. second of all, it was obviously sent from a store where they lost the slip and it was squished into the smallest possible retailer envelope. the fabric is beautiful but the dress is humongous like the previous reviewers said. i ordered a size smaller than us",2,0,0,General,Dresses,Dresses
945,53,Ordinary for the price,"I was so excited to order this sweater but was so disappointed when it came. the knit is somewhat stiff and the sleeves are not as bell shaped as pictured on the model. overall i would of kept it if it were much less money, for the price it is just an ordinary sweater with no style.",1,0,12,General,Tops,Sweaters
895,47,Didn't work on my pear shape,"After reading the reviews i decided to give this a try, but it just didn't work on me. i'm 5'8, smaller on top, and usually wear m in retailer sizes. this was ok in the shoulder and arm area but a little too snug for me in the hips. also, the diagonal striping made my boobs disappear and the pattern at the bottom emphasized my tummy and rear. not exactly the look i was going for. back it goes.",3,0,0,General,Tops,Fine gauge
805,43,Sheet,"Love the shape and cut of this top but it is so sheer you could see my belly button through it. if it was a dark color i would buy it. wore my regular size small. i'm 5'5""130lbs  and 32dd.",3,0,2,Initmates,Intimate,Lounge
945,43,If only it looked like the photo.....,"This sweater was a big let down. i am 5'2"" so i ordered it in a petite. it was so short that if i lifted my arms, you'd see my bra!! there is no way i could wear it without something under it- even with high waisted bottoms. and the bell sleeves look nothing like the pic. the entire sleeve is just wide, and it continues with little increase into the cuff. it is just short and boxy. it is going back for sure.",1,0,8,General,Tops,Sweaters
833,42,Not as pretty in person,"I was excited to see this top in person, but once i got a close up look at it (and also tried it on) i was disappointed. first, the color is much more persimmon orangey in person and that's a hard color to pull off for a lot of people. it just pulls any pink or red in your skin and highlights it. 

second, the top was poorly finished. i had to pick up two to try on because the lace was wonky across the front of the first one i grabbed. so much so that the lace was puckered because it had been",3,0,12,General Petite,Tops,Blouses
895,50,Wanted to love it - but . . .,"I wanted to love this. however, the fit was funky and the colors were muted. this is definitely something you must try on in the store. too risky to buy online due to weird fit.",2,0,0,General,Tops,Fine gauge
886,23,Shrinks!!!,"Ladies this top shrinks!!! i am very disappointed, i was in love with this top and the first time i washed it it shrunk a significant amount. i did not use a dryer, i laid this piece out to dry as i do with the majority of my knit tops and it shrunk. it is a lot shorter and much tighter, especially in my arms. if you love this top i might suggest buying a size up and washing it to fit.",2,0,14,General Petite,Tops,Knits
895,48,Very plain on the front,"This sweater looks soft and flowy on the model, but in the store it is rather stiff lace in the back and very plain in the front. i did not like the ribbing on the front bottom of the sweater because it pulled in places and didn't lie flat. way too expensive for what you are getting.",3,0,2,General,Tops,Fine gauge
886,34,Might be great if you have a bun in the oven!,"Again, bought this while wearing my retailer colored glasses. i loved the flowiness and color of the dark pink, and was convinced in the dressing room that this top made me look like a chic goddess, mid-vacation on the amalfi coast. i tried it on at home, and it straight up looked like i was wearing a maternity top. since i'm not with child, this one's going back!",2,0,0,General Petite,Tops,Knits
895,42,Pretty but just okay when worn.,I love the back detail but doesn't feel that comfortable on. i bought in green. it's fitted so get size larger if you plan to layer up. i'm 107 and bought xs size. i should have ordered the s.,3,0,0,General,Tops,Fine gauge
886,43,Not a great design,"This shirt is not a good look for a gal with hips. the fit at the top is tight (i ordered a small) but there is so much material at the bottom and if you are a little taller (i am 5'7), it hits at a place that is not flattering. i was hoping for something that hung straight down and would be good with leggings. this is not it...also the material is a little stiffer then i was expecting.",2,0,0,General Petite,Tops,Knits
886,39,Weird shape.,After seeing this on anthto's facebook page i was so excited to order. i ended up going to a store and trying on. i couldn't believe it was the same shirts when i first saw it. i thought this ran quite big. and the shape was odd. lots of material in the middle. i am a mom of 3 young kids and didn't want people to think #4 was on the way.,2,0,15,General Petite,Tops,Knits
895,54,Boxy,"I ordered this sweater in black and thought it was a pretty design and something different in a cardigan. when i tried it on, it was an odd fit and very boxy and unflattering. i wanted to like it and keep it, but i knew i would not wear it so, unfortunately, it went back.",3,0,0,General,Tops,Fine gauge
886,46,"Too long, poor quality",I ordered the pink in size xl. the color was pretty. the problem is the material was too thin and tight. it ran at least a size smaller than shown in the photos online.,3,0,0,General Petite,Tops,Knits
895,59,Gold thread,"This is a very pretty sweater, a bit boxy and short but cute. i am 5'1"" and ordered the regular xs in black. the thing i did not like about this sweater was the gold thread through the back lace. i would have kept this if it was plain black lace. just did not like that look.",2,0,2,General,Tops,Fine gauge
895,35,Not for tall ladies,"This sweater is a cute design but did not work for me. i am 5'9"" and this is way to short/cropped and looks awkward. the quality was so so, it looked stretched out in the front. it's getting returned.",2,0,1,General,Tops,Fine gauge
886,61,Lokka tunic,"Beautiful top, loved the color but shoulders were totally messed up and not sure if it was from
hanging at store or the way it was sewn.",2,0,0,General Petite,Tops,Knits
886,34,,"I ordered this in two colors, in my regular size. i washed and laid flat to dry....it shrunk like crazy. i held the one i washed up to the other unworn/unwashed one and it was at least two inches shorter. they may both be going back. i am so sad.",4,0,6,General Petite,Tops,Knits
886,55,,I purchased this top in blue and liked it so i ordered the red color. i hated the way the second one fit. i'm concerned the blue will not wear well after seeing the way the second one looked!,2,0,0,General Petite,Tops,Knits
975,28,Love but poorly made,"You guys, i love this so much! however, within one hour of wearing it, the back seam completely ripped. it fit me perfectly... sadly i&#39;ll have to return the damaged item. really sad it&#39;s all sold out too!",3,0,0,General,Jackets,Jackets
1060,49,,"Oh elevenses, i love your pants..the fabrics, the details, the length. i've found elevenses to be classic work pants. reliable, professional, well made. these are none of those things. the cardinal trousers are thin and the rise feels much higher that's it appears in the picture. the red pair are thin, stretchy and cheap. both pairs have to go back. i'm truly sad.",1,0,7,General Petite,Bottoms,Pants
895,29,Funky seams,"Love the design and the gold color, but the seams between knit and lace were a little weird and bunched/weren't smooth. maybe the one i tried on just needed to be ironed or something...",3,0,1,General Petite,Tops,Fine gauge
1060,38,Not worth the $$,"I loved the cut of these pants and the button accent on the pockets. however, the material was quite thin and the quality was not great- there were multiple snags along the seams. additionally, at 5'8, 130lbs i was swimming in the size 4. i would have tried sizing down if the quality was better.",2,0,17,General Petite,Bottoms,Pants
823,39,Huge arm holes,"Why is it so difficult to find a shirt that doesn't expose half of my bra if i lift my arm? 

this is cute (beyond the arm hole issue) but overpriced. going back.",2,0,11,General Petite,Tops,Blouses
1055,29,Looks can be deceiving,"I wanted these culottes to work so much! the fabric is gorgeous, but the size i ordered didn't fit. i'm normally a size 28 in pants, and i ordered a size 8. it was way too tight and made me look like i had a pooch in the zipper area. not what i wanted it to be. had to return them unfortunately.",2,0,0,General Petite,Bottoms,Pants
1081,50,So wanted to love it...,"Ditto what the first reviewer said, unfortunately. i was so looking forward to receiving this dress but the one received is not the one in the photos. the graphics are fantastic - still love the boats- but the top is not the same and they've added a fabric belt to the finished dress. the fit was perfect except for gapping under the arms (similar, i suspect, to what the first reviewer reported). i was also surprised by the fabric. based on the photos i was expecting something light and semi trans",2,0,4,General,Dresses,Dresses
1055,43,Not for big girls :(,Quality is fantastic but i feel like a 14 would have barely made it's way around one leg! this pant is way small in terms of sizing and not a style fit for anyone over a 6. a lot of fabric in the legs. nice pant but not for this girl!,2,0,11,General Petite,Bottoms,Pants
1086,44,Maybe one i got it's not right?,"Got the small petite. length is perfect, love the color, super comfy, very pretty. the problem is that you cannot wear a bra because under the armpits is so low that either shows your bra (a lot) or if u wear sans bra you may show your breasts (it's loose all around on top, so very easy to show everything. if i adjust the straps it works but then the waist goes up and it looks like i have a belly. i'm taking to a seamstress to see if she can take in under armpits, if not it's going back. i'm 5',",4,0,3,General,Dresses,Dresses
1055,63,,"These run small (i am 110 and got a size 4), they were a tad tight on top. the waist fit but felt a little too snug, short from waist to crotch and then bloomed out in a nice but stiff ish material. they are a dark blue animal print. i felt like bozo the clown goes to the jungle. they looked so silly i had to laugh. even with the 20% off, these are going back. not even comfortable to lounge around the house in never mind being seen by anyone in person!",2,0,0,General Petite,Bottoms,Pants
1081,42,Different dresses,"I loved the photo of this dress. upon examination of the dress (and trying it on) after receiving in the mail, the dress shown online is nothing like the dress i received save for the pattern. the dress i received has a side zip as well as a belt and no pleats on the top. the bottom is also cut straight across not as it appears in the photo. turns out it is not as flattering as it should appear.",1,0,4,General,Dresses,Dresses
1066,48,,"I ordered these in my usual pilcro petite size 6. they were impossible to button, which is interesting 'cause i also ordered the pilcro wide leg chinos in the same size and they fit perfectly, as usual. but it ended up being ok because i don't care for the speckled, slightly rough material or the contrasting piping. back they go!",4,0,2,General,Bottoms,Pants
1025,30,Not petite inseam...,"I was excited to see these jeans since they came in petite sizes and had a short inseam... unfortunately after ordering/returning several pairs, i found out that these are actually not petite jeans. please beware that if you are ordering these for the shorter inseam, they are actually 28 in... not 24 in as in the description. other than the inseam issues, they fit like typical paige denim.",1,0,1,General,Bottoms,Jeans
832,40,Frayed bottom hem.....,"This top is super cute, however the bottom hem is all frayed....couldn't really tell that from the pictures. the ""flutter"" sleeves are too big...looks funny with the fraying...runs a little large as well. loved the color! perfect with white denim!",3,0,3,General,Tops,Blouses
861,48,This is not red!,"I was looking for a shirt of this style. i thought it was very cute, but it is not ""red' as advertised. it is really a brick orange-y color, which is definitely not what i wanted. very disappointed. sent it right back.",3,0,0,General,Tops,Knits
80,47,Size and function,Too big and it's not secure enough to wear for swimming.,2,0,0,Initmates,Intimate,Swim
1008,67,Looks better on line,"I received this skirt today and was very disappointed. i don't know what i expected but it is not as i thought. even though the quality is very good and the fit is true to size, i may return it. the fabric of the skirt is just too busy, at least for me. i am just uncertain and even though i have many tops, the colors are just not matching. white looks better than any colored top with this particular print. i am going to try it on one more time and make a definite decision.",3,0,1,General Petite,Bottoms,Skirts
1008,50,Lovely prints,"I saw this skirt online and went to the store immediately to try on. i was a bit disappointed. the size is tts but the prints were prettier online. the material is ok. the regular is long so probably won't look good on a shorter person
if it is still available when the price comes down, i might buy it.",3,0,0,General Petite,Bottoms,Skirts
1066,60,Funky fit,I found these to fit odd. i am also use to wearing the skinny jeans so trying a wide leg was a bit weird anyway. the placement of the pockets and the way it hit my waist was awkward and not flattering. i am usually a 8/10 and the 8 fit but just did not look good.,3,0,0,General,Bottoms,Pants
1094,27,"Pretty, but already piling","I loved this dress and it fit great on me: 5'7, 115 lbs, wore an xs. it was a little tighter than i wish, but the s would have been too loose. unfortunately, when i received the dress the arms were already pilling. it is made of a mix of polyester, and while it's machine washable (yay), i can imagine this dress would be pilling very easily, and i wish the fabric was a higher quality for the price, so i returned it.",3,0,0,General,Dresses,Dresses
1094,46,"Cute, but no sale",The dress arrived with a few snags and the fabric already pilling. the fabric will only get worse with wear. return. cute concept; poor fabric quality.,2,0,0,General,Dresses,Dresses
154,35,"Pretty pattern, weird texture",I love the design and pattern of this top. it runs big so an xs was roomy on me but still cute. the neck is wide. i returned it bc the material of the top isn't for me. the texture is too soft.,4,0,0,Initmates,Intimate,Sleep
1094,39,Not flattering on,"I was so excited when this dress went on sale.  it is very soft and the print is so distinctive.  it is super comfy but not slimming or flattering at all.  i am a curvy girl,  wear a medium 8/10 and this made me look so wide!  the skirt is quit full,  a small would have fit but the top was tight.  so disappointing.",3,0,0,General,Dresses,Dresses
154,40,Shorter than expected,"After reading the reviews i placed an order because it was the only top that caught my eye on the entire price downs. lately all my usual l/10 sizes from retailer turn out huge so i ordered a size smaller from what i usually wear. all would have been ok if the top wasn't so darn short. for reference i'm 6 ft tall, 160 lb. it's weird that this top looks completely the opposite of the model on the photo, from a loose looking fit with longer sleeves looking like a stylized sweatshirt that is not what",2,0,4,Initmates,Intimate,Sleep
936,31,Shapeless,"5'1'' 43-31-43. i really wanted to love this coat: the material is nice, the green color is dark and rich, it has a hood. however, the cut is bad for me (and probably a lot of other people). the shoulders were cut too wide and impeded movement, and the bust and hips were cut too tight, overall it was just boxy. i have another boiled wool coat that i bought at retailer about 7 years ago and though it's cut oversize like this one, it has a much fuller sweep, so the proportions still seem right. also",3,0,1,General,Tops,Sweaters
1033,37,Disappointing fit!,"I originally got these in a 29 petite and thought they fit great right out of the bag (i'm usually a 6/8).. and within an hour of wearing them (to retailer, actually), the knees had gotten so baggy that they looked absolutely ridiculous; i've never had jeans do this. the salesperson at retailer agreed that they seemed very odd. i exchanged for a 28p at her suggestion, and i just hate them. i'd say the smaller size seems every so slightly small, but nothing major - but the waist actually folds over a",2,0,0,General Petite,Bottoms,Jeans
1140,36,,"This skirt is not what i was expecting at all. for starters it runs large, i expected it to sit at the natural waist and it is definitely made to do so, but it was a good two inches too big and therefore wouldn't lay flat and gaped at the front. no bueno. my biggest gripe, though, is that the color looks nothing like it does in the picture. they have it paired with an ivory top and the two look like they match so well but do not be fooled, the background color of this skirt is not even close to",3,0,3,General Petite,Trend,Trend
1047,43,The fabric is heavy,"I wanted to love these pants, but they were larger than i expected and the fabric is very heavy. almost like a thick sweater.",3,0,0,General,Bottoms,Pants
1094,67,,Very cheap looking material. looks cheap to cost $158.,1,0,1,General,Dresses,Dresses
1094,36,Washed out looking,"The colors in this dress are much less vibrant in person. the scoop of the neckline is very wide and deep. i know others have posted that this is a great dress for work, but not in my workplace.",3,0,0,General,Dresses,Dresses
878,69,,"I really like the sundry brand. however. this is thin and to me out of character for an retailer tee. it look adorable in picture. however the coloring is way off. the navy is almost black it's so dark and the kaki stripe is a green. it's nothing like i had hoped it would be. fabric in very thin and more like a pajama top. so disappointed. it will go back. i do not make it a habit to bash a product. however with tax, shipping and 83.00 price tag. 103.11 is absolutely terrible.",3,0,15,General Petite,Tops,Knits
1094,48,Comfortable but not exciting,"This is a comfortable sweater dress, and the quality of the material seems good. the solid blue strip down the front makes it look very bland. i think it would need some dressing up with a necklace or scarf. i decided to pass.",3,0,0,General,Dresses,Dresses
936,41,,"I ordered this in the orange color from online. they were sold out of petite so i ordered medium (regular). i liked it, but just not flattering. i am 5'2"" and the coat was too big. sleeves were past my hands. i think because i'm ""curvy"" the straight cut of coat would not have looked good on me in a size small. it was a nice coat, just not for me.",3,0,0,General,Tops,Sweaters
936,35,Too much for this sweater,"Im 5'1"" and about 110lbs. ordered the small because i do have some curves- it was huge- more like a large and didnt have much structure at all. the wool was very soft and stretchy. and like others have said- kinda orange- not true coral color. it fit me like a throw blanket- its going back for sure. might purchase again if the petite xs is back in stock and on sale- this should def be under $100.",3,0,0,General,Tops,Sweaters
854,59,Misleading picture!,"The top i received was large, really long in length, pockets in the front along the seam, and lots of volume in the back without any princess seams to give it shape. the id #'s matched, but that's about it. returned!",1,0,1,General Petite,Tops,Knits
949,43,,,2,0,0,General,Tops,Sweaters
873,50,Large and very wide!,"I ordered this in a small petite and medium petite , and i am a huge fan of a*k. i put tried on the sp. while it fit, it was very long, even for a petite. what i hated about it was that the piping on the top made me look very wide. even a long necklace wouldn't help deter the look. on a positive side, the blue was a very nice, cool color. i am usually a small to medium in a*k (6-8 in tops) and the small fit well in the arms/bodice, just too much fabric for me. returning!",2,0,13,General,Tops,Knits
873,69,Quality & cut,"My perspective is as a sewer so i'm more picky perhaps. this top is poorly made. the fabric pattern is crooked or not consistent in each piece. sewers do this to save $ - squeezing the pieces on the fabric. it looks sloppy. the cut is very full; the bottom edge measures 104"" around. for my figure, curvey, at 5'6"" and 150lbs, this top is not flattering it looks maternity. perhaps best on a slim figure and with leggings.",1,0,2,General,Tops,Knits
873,71,Pretty but not for me,"This top reminded me of a maternity top. cute, but better suited for someone smaller chested.",3,0,0,General,Tops,Knits
909,46,Farm animal pullover,"Wanted to love this sweater for its beautiful colors and cute graphic, but the fit is uncomfortably small and it is so itchy i was yelling, ""get it off"" in the fitting room. bummer.",2,0,0,General,Tops,Fine gauge
1099,57,Paisley silk maxi dress,Beautiful dress but have to return. way too big & long for me. medium is the size i wear but i think i would need an extra small.,2,0,6,General Petite,Dresses,Dresses
1001,39,"Runs big, great material but not as pictured","I agree with the other reviewers that this runs big. unfortunately there is nothing smaller than an xs so this is going back. i love the lyocell material, i have another skirt with this material and wanted to love this as well but it is too big and with the drawstring pulled tight to fit it doesn't look right. it is not as pictured as well. the skirt i received is a medium blue denim, not the lovely light blue as pictured, another reason why i am returning.",2,0,1,General,Bottoms,Skirts
