Clothing ID,Age,Title,Review Text,Rating,Recommended IND,Positive Feedback Count,Division Name,Department Name,Class Name
1104,25,Amazing peach color!,"I ordered this dress in both colors. the peach color is so beautiful in person. i'm planning to wear this dress for our rehearsal dinner at the end of the summer, if i can hold off until then! definitely worth the price.",5,1,6,General,Dresses,Dresses
878,63,,,4,1,0,General,Tops,Knits
1104,54,Perfection.,"This dress is incredible. i saw a sales girl wearing it in my local retailer and loved it! i bought it in the navy color, it's gorgeous in person, very bright, vibrant colors. i am 5'9 34 c bra 27 inch waist and the s was quite big on my waist. i kept it anyway because the xs has been sold out, and got it taken in a bit. i wore it while vacationing in mexico and it definitely turned heads, if you're thinking about buying this dress, do it, you won't regret it!",5,1,0,General,Dresses,Dresses
984,28,Nice quality but too short for my tall frame,Love the look and quality of this jacket. i&amp;#39;d say it fits true to size but it is way too short for me (i&amp;#39;m just under 6&amp;#39; tall). wish these came in tall sizes!,4,1,0,General Petite,Jackets,Jackets
866,26,"Cute top, but back is more of a jersey material","I really love the front of this shirt. however, the back of the shirt is more of a jersey material so it doesn't seem to match the front of the shirt. i still wear it and it looks cute, but it threw me off a bit at first.",4,1,0,General,Tops,Knits
1104,29,,Absolutely love this dress! fits true to size and makes anyone look fabulous,5,1,0,General,Dresses,Dresses
868,61,Nice color,I liked the color of this top but i didn't really like the ruffled stitching around the middle. it looks like someone just tacked on the bottom half. i bought this for my daughter and she likes it. i think it is comfortable and a good top to knock around in.,3,1,0,General,Tops,Knits
984,45,Perfect jean jacket,"Per other reviewers, i sized up from a small to a medium and the jacket fits me just right with room for layers. it is short (cropped), but i like where it hits me and is versatile for jeans and dresses.",5,1,1,General Petite,Jackets,Jackets
984,39,Great asset,"I have alst year's version,a dn they are essentially the smae, minus some leather parts removed... this jacket is great, the back si a little shorter, so it goes so well with peplum tops an ddresses with higher waists (without looking bigger from the back when the hem is longer and hits where the skirt aprts bulge out). i love hte darker color, i wish it came is super dark rinse...

i usually buy petites, but i never tired on the eptite in this jacket... i am holding myself back to order this on",5,1,7,General Petite,Jackets,Jackets
1104,36,Gorgeous,"Bought both colors in xs and soooooo glad i did. this dress is absolutely gorgeous in either color... will have (do to the nice quality) and wear (very stylish) for a loooooong time.

a must have for the summer!!!!!!",5,1,0,General,Dresses,Dresses
878,41,Comfy and fun!,"Comfy sweatshirt with fun polka dot details. soft and not baggy. a little on the shorter side so i think i will layer a lace cami underneath and it will look even prettier. i'm 5'7"", 140 pounds with an athletic, hourglass shape, 32dd. i bought the ""2"" which equates to a medium since i wanted it a little looser being a sweatshirt (i'm normally an retailer small but i don't think that would have worked in this case as it would have been too fitted). great comfy weekend piece!",5,1,11,General,Tops,Knits
1182,37,Great tee,"I could wear this every day, it is stylish and comfortable",5,1,0,General Petite,Tops,Knits
868,55,Pretty and feminine,Pretty top. love the color and the large ruffle. makes it great for layering or with a pretty necklace.,5,1,0,General,Tops,Knits
868,83,Sooooooooo cute!,"Love this top!
it is a full/ swing top, but the slightly shorter length balances out the fullness perfectly.
i have been wearing it with a contrasting fitted cami and get tons of compliments.
love both colors, and having fun wearing them.
and after one washing the fullness is softer and looks like the pic.
runs true to size and in the arms slightly tight, so i went with my usual med and fits perfect.
if you have issues with sleeve size would recommend going up a size, otherwise very true to size",5,1,1,General,Tops,Knits
868,35,Peplum hem tee,"The styling of this top is really cute. it fits perfectly on the shoulders and gets bigger at the hem for the baby doll look. my biggest complaint is the quality! it's really cheap and feels like the quality i would expect to see at a cheap retailer. it catches lint like crazy and because the hem is just a pearl edge, it curls really badly. i buy quite a bit from here and this is the worst quality item i have seen in a long time. not worth the $$ if paying full price.",3,1,2,General,Tops,Knits
565,38,,"Love, love, love this dress. it is very slimming. it hugs you without really touching you. leaving the tie and a few buttons open gives it more of a casual feel.",5,1,3,General Petite,Trend,Trend
984,35,So comfortable and chic,"I'm 5'3 130# with a 32dd bust. i usually wear small in retailer/ cloth and stone/ running horses. the small fit me fine, but with no room for layers underneath. the small was very snug. would be perfect for california evenings. but, i live in the north east! the medium still has a great shape on me, still fitted at the waist (27inches), but enough room to wear a light sweater or flannel under. the medium still also looks great over my maxi dress.",5,1,0,General Petite,Jackets,Jackets
1104,45,,"This dress is gorgeous!!! i love it! i bought it to wear to a july wedding. i got the navy and it is so fresh and crisp in color. the sizing is on spot! i slipped it on and it was comfortable, easy and stylish. i am 5'7"" and typically xs. it falls exactly as portrayed in the online photos. it is lined in the skirt and the top is stretch jersey in the best weight! i am in love!",5,1,7,General,Dresses,Dresses
868,65,,"This shirt is one of my favorite retailer purchases ever! it is well made and is perfect for work or the weekend. the first time i wore it, i received so many compliments!",5,1,4,General,Tops,Knits
878,41,Perfect sweatshirt,"I want to live in this sweatshirt. it's so comfy, but also well-cut and lays nicely, not boxy at all. i'm typically a 10-12 or l in tops and the 3 is roomy without looking sloppy.",5,1,1,General,Tops,Knits
868,69,Clever white edges,"I liked this top even though it was a definite 'swing' style. i ended up altering it to remove some of the fullness.
looks great with jeans as well as black pants for a dressier look. very soft and comfortable fabric. wish it was just a little bit longer.",4,1,0,General,Tops,Knits
1104,36,Love this dress!,"After missing out on last year's similar dress, i am so glad i finally purchased this one! it is beautiful in person. i bought to wear to a wedding, but i am curious if others think it might be too white? i bought the peach color. i will keep this dress no matter what. hope they come out with more next season!",5,1,0,General,Dresses,Dresses
984,69,,I read the reviews and because this jacket is pilcro i took a chance. i was thrilled when i rceived this jacket. darker color of denim with weathered edges. i absolutely love it. don't let it get away. great jean jackets are hard to come by.,5,1,0,General Petite,Jackets,Jackets
984,55,Almost perfect denim jacket,"Love this denim jacket (also have it in white) the reason i didn't give it 5 stars all around is the distressing is just a bit too much (none on the back which is kind of strange). i'd love it even more if it wasn't distressed at all, then it could be dressed up much more for work. but overall it's my favorite, great fit and a bit of stretch so very comfy. please make this in some other denim colors!",5,1,0,General Petite,Jackets,Jackets
984,36,Perfect,The cut is brilliant-the wash is subtle-the weight of the denim is sturdy but not stuff-and the stretch is just right. love it. the perfect staple. a scarf in the fall and rolled sleeves in the spring.,5,1,2,General Petite,Jackets,Jackets
984,71,,Love it; the bit of stretch in the denim makes it less stiff than traditional denim.,5,1,0,General Petite,Jackets,Jackets
1024,65,Super nice,I love these. i'm between a 29 and 30 and as the 30s were sold out i had to go with the 29s. they fit well. as expected. very nice fabric. good design. have to wear a short shirt or one tucked in. fabric has a bit of stretch which is also nice.,5,1,0,General,Bottoms,Jeans
984,68,I wish it were alless stiff denim. runs small,"I've been looking at this jacket on line and finally went to the store to try it on. i really liked the styling but the denim was quite stiff. i'd prefer a softer kind of fabric. i wonder if it would soften if it was washed. also, it ran surprisingly small. i usually take an xsmall or small but the small didn't leave me enough room to comfortably bend my arms. the medium worked better. i wonder how others feel about the fabric and and the sizing. i think i'll wait and see if this one goes on sal",3,1,16,General Petite,Jackets,Jackets
984,43,Terrific denim jacket,"I lost my favorite denim jacket on a trip a few years ago and haven't found one i really liked again...until now. great quality - just heavy enough but not too heavy, just stretchy enough but not too stretchy, great color/design. no complaints. i read the other reviews and was happy to have ordered one size larger than my normal. i typically take a small but the medium in this is perfect. it is possible i actually like this jacket better than the one i lost several years ago, which is a big endo",5,1,3,General Petite,Jackets,Jackets
1104,30,,"Beautiful colors and silhouette (i got the navy). the skirt is lined and flows wonderfully when you walk. i've gotten a ton of compliments on it. i'm 5'9"" and the high hem falls a few inches below my knee, and the low hem falls to my ankles.",5,1,7,General,Dresses,Dresses
1024,40,Cute versatile culottes,I love these culottes and i think they will be everywhere this coming spring / summer. the high waist is perfect and looks great with shorter shirts or tucked-in. the denim is high quality and a nice medium dark color.,5,1,0,General,Bottoms,Jeans
984,47,My new favorite denim jacket,I'm glad i listened to the other reviewers...i ordered a large instead of my usual medium. it's roomy enough for a sweater underneath. i love the denim! it's very soft and has some stretch. my other denim jackets are stiff even after years of washing. i also love the darker denim.,5,1,0,General Petite,Jackets,Jackets
1104,39,,,5,1,0,General,Dresses,Dresses
984,34,Favorite jean jacket,"I'm 5'4"" 125 lbs ordered small. fits perfect. super soft denim. love the color love the worn in feel",5,1,0,General Petite,Jackets,Jackets
1104,38,,"This dress is stunning- vibrant colors and flirty feel to it. i got the small and i am a 34b/27 pants, 132 lbs- great fit. i only question two things- am i tall enough to pull off the extra fabric in the back and what the heck do you where for a bra? those two considerations are why i didn't give it 5 stars.",4,1,1,General,Dresses,Dresses
984,38,Perfect denim jacket,"I have been searching for the perfect denim jacket and this it! i love the darker color, more modern day less 80s. it runs a little small. i am always either a s or xs at retailer. lately, their clothes seem to be running a little bigger, so i have been an xs in most tops. when i order online, i never know which size to get. i ordered an xs, however it was very tight in the arms and across the shoulders. i wanted to be able to roll the sleeves up, so i returned it for a s and it fits great. i was",5,1,0,General Petite,Jackets,Jackets
895,36,,I have received so many compliments. it's my favorite,5,1,0,General,Tops,Fine gauge
1104,41,Best dress ever!,"I wore this dress for the first time yesterday... i have never received so many compliments on a dress before! several people even stopped me in the streets of nyc to tell me how beautiful this dress was!
it is an absolute must-have!",5,1,0,General,Dresses,Dresses
1131,36,Stylish jacket,I love the pattern on this jacket and enjoy the bell shape. a fun jacket to through on and add quick style to a skinny pants.,3,1,2,General,Jackets,Outerwear
984,47,Adorable!,"I love this little jean jacket! i am petite and usually get a xxsp , but went for a size up. i'm glad i did. it fits a little snug. the color is true to the photo and the material is a medium to heavy denim. the arm length in the petite size is perfect for me. i love this - over maxi dresses, tanks, etc... adorable jacket - great buy!!",5,1,0,General Petite,Jackets,Jackets
1104,63,"Stunning, flattering, and versatile.","This dress first caught my eye online. due to the price i resisted. then i saw in store and tried on...i decided to hold off for a sale, but my will was getting thin. once i saw it start to sell out online, i had to take the plunge. i knew this dress was a must have. it is super flattering and comfy! the best of both worlds. i'm small-chested so both the s and m fit, but the seam on the s fit a bit higher, which was more flattering on me, so s is what i got. it can be dressed up or slightly down",5,1,0,General,Dresses,Dresses
831,35,Pretty blouse!,"I love this blouse! i just bought it recently and have yet to wear it out other than trying it on. this blouse looked very nice on me which can be challenging. i don't live near an retailer so i have to order online exclusively. i have larger hips (135lbs, 5'6) and finding flattering tops can be tough. sometimes they look amazing online and then once i try them on, they just don't look right. some shirts have a tendency to accentuate my hips too much making me look shorter. this top looked great a",5,1,0,General,Tops,Blouses
984,35,Too distressed,First i ordered a m. i'm normally a 8-10. the m was too small so i returned and ordered a lg. the lg fits great but there is a huge area of distressing on the shoulder that will turn into a hole. i love this jacket but cannot keep it in its condition. hopefully i will make it to the store soon (there are none w/in an hour of me) and look before i buy.,4,1,2,General Petite,Jackets,Jackets
1104,56,Stunning...,"I purchased the navy color of this dress. not only did it look good, but felt good as well. since it is for a wedding, i also purchased a white crochet cropped ""sweater"" to wear over as well, making the perfect dress for the mother of the groom. could not have been happier.",5,1,0,General,Dresses,Dresses
836,41,Cute top,"This top looks pretty much like it does not the model. the sleeves are a nice length and are not too tight. the fabric is light weight, but not see-through. it does not wrinkle a lot. i've gotten several compliments on it and it goes with lots of different bottoms and will work under jackets too. the v-neck is pretty deep, but doesn't show so much cleavage that you couldn't wear it to work.",5,1,0,General,Tops,Blouses
836,32,Adorable,"I purchased the floral patterned version and get complimented every time i wear it. i found it to be pretty true to size, even after washing. it's a little sheer, so you'd definitely want to wear a camisole underneath for work. it's a great top for spring/summer!",4,1,4,General,Tops,Blouses
836,21,Beautiful top!,"Love this top! made with 100% cotton, a vintage look, and flattering details this top is a winner for me. i think it fits true to size (got my regular size 0) and i did not need the petite and i am fairly short (5'3""). it is somewhat see through, but with wearing a nude bra and not wearing it to work, i think it can be worn without a cami. the perfect lightweight, comfortable, standout piece for the summer time :)",5,1,8,General,Tops,Blouses
836,59,Love this blouse,"I really like this blouse a lot. very very easy to wear!! i wore with pencil skirt to work and with skort as shown similar on model with sandals on weekend. very flattering and great blue color!!! very happy with this purchase. highly recommend. i am 5'6"" short torso and my usual 6 worked.",5,1,0,General,Tops,Blouses
844,53,Lovely printed blouse,I just purchased this beautiful printed blouse in the pink color and love it! i almost always wear a size small at retailer (34d-27-35) and the fit and length are both perfect on me. if you are smaller chested you can easily go down a size. i absolutely had to have this whe i first saw it at the store and noticed how popular it was as i had to order it due to it selling out like hot cakes there. what i like about it is the texture and the ruffles at the front plus the length of the sleeves stop ri,5,1,4,General Petite,Tops,Blouses
936,27,"Love, love, love!",Bought this on a whim and it exceeded my expectations. i didn't know what to expect with the quality of the fabric but this is incredibly soft and warm. haven't worn it outside yet but i can see this already as one of my favorite items. i'm usually an extra-small but the xxs also fits. it's a great buy especially since it's on sale now.,5,1,2,General Petite,Tops,Sweaters
895,62,Loveee,"This is an awesome vest - so soft, cozy, and i cannot wait to wear it through fall and winter. for sake of not repeating all the positive aspects that the previous reviewers did, i'll mention the one flaw...no pockets :( still totally worth full price in my mind though.",5,1,7,General,Tops,Fine gauge
836,41,,"I find that maeve shirts tend to run a little small. i'm usually an 8 but needed this in a 10. this shirt is reallly just perfect. great sleeve length. just the right amount of v neck. beautiful pattern with a vintage feel. i love the combo of stripes, polka dots and sweet flowers.",5,1,23,General,Tops,Blouses
831,50,My favorite new blouse,"This blouse is so pretty. i love the long tie. the pattern is very unique. it is a thin, light weight fabric so you can easily wear it underneath a leather jacket.",5,1,3,General,Tops,Blouses
844,54,A standout,"This is a beautiful blouse...sheer and feminine. i am small busted and slender so i need a size smaller than usual. it is a full top...can't tell exactly how full in the photos but with a small chest there is just too much under the arms. so if your chest is more ample you could prob order your regular size. this is supposed to be a full, shorter fit...i would say the style is going to look better on someone who is a little taller with a medium sized bust rather than someone who is shorter and b",5,1,13,General Petite,Tops,Blouses
895,47,,,5,1,0,General,Tops,Fine gauge
1066,41,Lovely!,"The photo of these is truly misleading - they are a beautiful vibrant print - see the close-up photo. they are much longer on a regular person - they come a few inches above my ankle and i am 5'5""there is a neat slit off to the side on the front of each (like a pleat) that really allows a nice flow. these look great with boots, flats and do sit lower on the waste as i think they run slightly large. not lined, but drape beautifully. there are pockets (sewn closed upon purchase) and pack pockets.",5,1,0,General,Bottoms,Pants
836,43,Better in person,"I didn't think anything of this top online (i really don't care for how they styled it) but in store it was more interesting. i'm currently anywhere between a 2-4-6 / xs-s-m, depending on the style, 5'3"" 120lb 34b. size 2 regular in this top fit me perfectly. for some reason, on me, the sleeves were elongating and flattering (closer to my elbow) and the overall length hit me perfectly at the hip like on the model, the fabric is lightweight and therefore slightly sheer but, due to the color and p",5,1,1,General,Tops,Blouses
836,23,Cuter is person,Nice fabric and cute design. a little low cut.,4,1,0,General,Tops,Blouses
907,25,,"I absolutely love this sweater!! it's soft, easy to wash, and looks great!",5,1,0,General,Tops,Fine gauge
836,51,Airy and flattering,The blue motif is a gorgeous indigo with an interesting pattern. a short tunic that drapes nicely and is flattering. very happy with this purchase. i plan to buy a 2nd for my mom to keep her cool and stylish.,5,1,0,General,Tops,Blouses
1103,49,Beautiful color,"This dress has potential, but it didn't work for me. it runs true to size to a little big, i ordered medium, my usual size for maeve). as for length it fit me as the model (5'9""). the reason i'm not keeping it is that i wish it had some darts in the back to help define the waist a bit,",4,1,2,General,Dresses,Dresses
866,46,Really good quality tee!,I love this tee! the material is thick but not too thick. it's highly flattering- i love that the sleeves are a longer short sleeve to cover up the bingo wings. the shimmer on the front adds something special.,5,1,5,General,Tops,Knits
907,29,Cute top,"I got this top in the black and i love it. the bottom is a silky material that's really beautiful, and the cutout details are really pretty. so many of retailer's sweaters are enormous, but this one fits tts. 

my one complaint is that the bottom white part wrinkles really easily.",5,1,6,General,Tops,Fine gauge
895,66,Cutest vest,My daughter and i both purchased this vest at an retailer store. this vest is so flattering on and is so much cuter in person than in the online picture. it is chic and stylish and will definitely be a staple for fall and winter.,5,1,6,General,Tops,Fine gauge
895,32,,"This is a great piece to help ease on in to the chillier days of fall and winter. it's versatile- i can see myself wearing it with plain short or long sleeved tees or even tops with more elaborate padderns or button downs! there's so many options i cannot wait to put this gorgeous piece to use! just as an fyi, the sleeve openings are slightly unfinished and have a frayed effect to them. this may not even be noticeable if you're not looking right up close. for me, this adds to the unique quality",5,1,2,General,Tops,Fine gauge
1080,74,"Beautiful, vintage feel, delicate beadwork","I just got this dress in the mail today and it is even better in person! the description didn't give as much information as i wanted so i'm going to be very detailed in this review. i did take off one star for quality because some of the beads are already loose (two fell off when i picked the dress up for the first time), and i'll have to hand sew others on more tightly. my usual size is a pxs or p0, and there were no petite sizes available. however the size 0 fits perfectly, no alterations need",5,1,9,General Petite,Dresses,Dresses
831,63,Very interesting design,"When i received this blouse, ai noticed that there were gold dots all over the blouse and they were very sticky. some of the fabric would stick to these dots. i thought it was because the weather was sticky and humid. however, after hanging on my closet door, the dots are still sticky. i do love the design and fabric so i will try not to let the sticky dots bother me.",5,1,0,General,Tops,Blouses
844,41,Fun and flowy,"Wasn't sure about this top based on reviews, but glad i purchased! pretty print, looks great with denim. very loose, flowy top. hangs a little short, but that's the style of this blouse. fit true to size. i usually wear a 2/4 and xs/sm with 30dd. size small worked for me.",5,1,0,General Petite,Tops,Blouses
844,40,Beautiful shirt,Ordered the shirt online. beautiful print and good quality material. runs very large - size down 1 may be 2 sizes as the material on the body is very wide. i will be exchanging it in the store.,4,1,0,General Petite,Tops,Blouses
831,40,Beautiful fabric,This too is so beautiful in person. there is gold dots all over the blouse that are not overwhelming. i love this top with business attire and denim. fits tts.,5,1,0,General,Tops,Blouses
836,32,,,5,1,0,General,Tops,Blouses
907,49,"Nice basic piece, will get a lot of wear.","I tried this in the store and i like it - nice and soft, good basic design that will pair with many pieces. but i decided to wait because of the price. i'm sure i would get a lot of use out of this top, but ultimately it didn't thrill me enough to make it my top priority purchase. i bought a sweater that was on sale instead. still, a very nice top. i may buy it eventually, especially if it goes on sale.",5,1,3,General,Tops,Fine gauge
895,24,,,5,1,0,General,Tops,Fine gauge
895,70,Soft patterned long vest,"I bought this in a petite size s after trying on the regular size in the store. it was a good move because the proportions in length and width are more flattering. the pattern is busy but works well with patterns in the same color group. it has no finished seams on any edge but that makes it drape nicely. it is a soft, soft fabric, almost fleece-like but not plush.",5,1,1,General,Tops,Fine gauge
907,30,Great piece,I love how soft the sweater materials is and that the built in layer piece falls so nicely. i purchased a small in black and have already worn it with jeans and heels for a dinner and with cropped work pants for the office. the bottom piece does wrinkle a lot but you can easily smooth it out. really quality materials and on sale this is quite a steal!,5,1,1,General,Tops,Fine gauge
844,47,Beautiful and timeless,"I am 5.6"", 138 pounds. i purchased this in a size small. it is flowy and not too short. it has a comfortable, but still feminine and beautiful fit. one of my favorite new blouses...the red print is gorgeous",5,1,0,General Petite,Tops,Blouses
