Clothing ID,Age,Title,Review Text,Rating,Recommended IND,Positive Feedback Count,Division Name,Department Name,Class Name
850,27,"Gorgeous, flattering blouse!","This is one of my absolute favorites! the design is perfect, and the fabric is so beautiful. i don't love the coral color, but the mixed pattern is amazing. it runs a little large. i sized down one size and it fit perfectly. it's very flowy and comfortable. it's these unique, special designs that end of being my favorite retailer purchases. i've gotten so many compliments. very highly recommend!",5,1,4,General Petite,Tops,Blouses
1078,49,Cute but skip the petite unless you are very short,"Beautiful colors, especially the pink. i am 5'3"" and about 124 lb. i got the small petite but am thinking of exchanging it for the regular xs. not only is it short hem-wise, which i don't really mind, but it is short in the waist. very pretty and good fabric.",5,1,3,General,Dresses,Dresses
850,49,Manette clipdot blouse,"I love the style of this top. i just wish there were a slimmer version of it. unfortunately, this top doesn't suit my long, slim midsection. it is so wide, it completely hides the waist. i think it would look adorable on a different body type.",3,1,7,General Petite,Tops,Blouses
1081,35,Elegant and well made,This dress caught my eye because i don't have anything like it. i wear between a m & l and preferred the large in this dress because i have a large bust. i usually wear a 10 in slacks and 12 in tops. i love the lace on this dress because it looks very delicate in the picture but it is very heavy and well sewn onto the fabric. it is durable while still looking elegant. i also like that it is in navy and not black. it is also nicely lined. i plan on wearing a colorful scarf with this dress.,5,1,3,General Petite,Dresses,Dresses
833,60,Lovely,A beautiful combination of eyelet with a soft fabric which lays beautifully. this does not make you look bigger then you are and i kept tts so the eyelet did not pull. mine fits perfectly. i personally will wear a cami under it as it is a bit sheer for me. it has an almost peacock print to it in colors of brown and tan. the black buttons down the back adds interest and charm. just adore it!,5,1,3,General,Tops,Blouses
1081,53,Well made,This dress looks great on me. it gives a slender appearance which hides a lot and it's easy and comfortable to wear.,5,1,1,General Petite,Dresses,Dresses
850,38,Beautiful blouse; very flattering,"Overall, gorgeous blouse; very flattering. i love the sleeves; very unique and also flattering. i love how the blouse is a fit-and-flare from the bust. it's fitted at the bust (but not tight) and drapes with an a-line style. the fit of this blouse is truly flattering to the figure. no issues with inappropriate amounts of cleavage showing or anything. the ties are weighted on the end with metal tubes, which i really like because it makes the strings drape nicely. the back drapes beautifully. i fe",4,1,29,General Petite,Tops,Blouses
850,37,,,5,1,0,General Petite,Tops,Blouses
984,42,Looks better on,I first saw this jacket hanging at the store and it didn't look very cute. i saw it again on sale so i decided to try it on. i'm so glad i did! the inside gray material is so soft. i have broad shoulders and this jacket did not hinder my arms at all. it is very comfortable. i bought the x-small and was very surprised at how roomy it was. the sleeves are a tad bit long but the gray inner lining has an elastic cuff so it can be pushed up. not sure if the xx-small would've been too small or if the,5,1,0,General,Jackets,Jackets
850,50,,"Good quality material. i got size 10 which is a little too big - size 8 would probably be better. very pretty, feminine top. a little too full in the waist/skirt area.",4,1,0,General Petite,Tops,Blouses
1104,41,Fun tag sale find,"For me, the tag sale is an opportunity to take a second look at items that i may have overlooked earlier, to pick up something fun at a good price. i found this dress in two colors in my size in the store! i took my usual xxsp at 32-24.5-32. length is perfect - just above the knee and the top is flattering with not too much fabric in the skirt. overall, this is a really cute staple dress. looking forward to wearing it in the spring. larger busted ladies size up. it is meant to be fitted in the t",5,1,4,General,Dresses,Dresses
1104,26,Great dress,I absolutely love everything about this dress. it can be dressed up or down. no complaints.,5,1,4,General,Dresses,Dresses
1078,25,Cute and fun!,The horizontal lines on the skirt and top gives the wearer and very nice dress. i am short so i got the 6 petite and it fits perfectly. the fabric is thick and stretchy.,5,1,0,General,Dresses,Dresses
850,34,The right kind of casual,This is a great top to pair with jeans to step a casual night up a notch.,5,1,1,General Petite,Tops,Blouses
850,25,,,5,1,0,General Petite,Tops,Blouses
984,31,Easy jacket,"Slouchy relaxed fit. well sewn together and hangs well on the body. bottom hem hits upper thigh. good length and soft, easy fabric. light layering option as well. good spring jacket, can be kept on indoors without getting too hot.",3,1,0,General,Jackets,Jackets
1078,47,Great dress or tunic,"The colors are more vibrant than the photo indicates. indeed, though, the dress is very short and does pair well with leggings and boots.

i like that the dress highlights my hour glass figure, but with a generous nod to my curves with the accommodating skater skirt.

love it! will be easy to wear casually and work appropriate, too. the sale price was a huge bonus.",5,1,1,General,Dresses,Dresses
984,61,Top coat,Top of the line! very well made and on sale to boot. i love the style and received a compliment from my sister when i wore it. i love the layered look.,5,1,0,General,Jackets,Jackets
850,52,"Love, love, love this tunic!","Perfect little summer tunic that is very flattering. paired with a skirt, jeans or cropped black pants- this top is perfect! the cut in the front is not overly deep- so a cami is not necessary. i am usually a l or xl or 12 in retailer tops and i have a 10 in this top. so it is sized slightly larger than usual.",5,1,1,General,Tops,Blouses
833,56,Sleeves are really small,This shirt is really pretty but the sleeves are so small. i normally wear between a 4 to a 6 or a size medium and i could not get this shirt on. i wish it fit but a size large would have been way to long and loose.,3,1,0,General,Tops,Blouses
1078,68,,"I love this dress because its very playful and bouncy. it puts me in a light hearted mood when i wear it. i originally wanted to buy the grey color but my store only had the navy, so i tried it on. the navy is brighter and more colorful than it looks on line and the stripes are more varied in color than in the picture - so its quite appealing and vibrant. the lines of the dress are also quite flattering. all in all, its a fun dress!",3,1,1,General,Dresses,Dresses
850,39,Perfect top!,This blouse fit better than i expected. looks great with jeans and is an easy go to top!,5,1,0,General,Tops,Blouses
1081,40,Comfortable and chic,"This dress is so comfortable, and i love the unique faux leather skirt and lace design. it really adds a special touch to the dress. i only gave it four stars because the top half is pretty boring...i wish the neckline wasn't so matronly. i'll definitely need a bib necklace or scarf to dress it up. i'm 5'5"" and 115 and ordered the xs. i wish the dress cut in a little more at the sides to accentuate an hourglass figure, also. my husband loved it.",4,1,0,General Petite,Dresses,Dresses
984,53,,,5,1,0,General,Jackets,Jackets
850,45,Perfect balance of classy and sexy,I love this top! not sure if i would picked it up in the store; i received it as a gift from my husband. kudos to him as it was a great choice. i love that the sheerness and lace make me feel a little sexy but the long sleeves and camisole offer the modesty i tend to crave. really beautiful and can be worn either with jeans or a dressier skinny pant for a night out. hd in paris never fails to please with their aesthetic and quality.,5,1,1,General,Tops,Blouses
850,28,Great top,This top is great for spring- it's super light and can be dressed up or down depending on what you're wearing it for. fits true to size and is great quality.,4,1,0,General,Tops,Blouses
1104,33,"Cute fit, perfect length","I've admired the various iterations of this dress and finally found one in the sale room, much to my delight! i'm generally a sale shopper, so this doesn't mean i didn't think it was priced well. i have the oatmeal top with yellow/gold/orange pattern on the skirt in xs. the small fits comfortably up top, but on my petite frame, the top just looked too big, so i went with xs. i suppose the straps are a bit confusing, but their easy to figure out if you just look at them for a moment before puttin",5,1,0,General,Dresses,Dresses
1078,71,Flattering,"This dress is comfortable as well as flattering, which does not happen very often!
looks good with navy tights too!",5,1,0,General,Dresses,Dresses
984,46,,Love love love this jacket!! great spring and fall weather.. very stylish!!,5,1,0,General,Jackets,Jackets
984,56,,,5,1,0,General,Jackets,Jackets
1078,36,Cute dress,"Based on some reviews i decided to get the regular xs, even tho i am an xs petite (5'2, 107 lb, 32c) i found the fit to be flattering -- fitted enough but not too loose or tight. the length is perfect and work appropriate, and the material has some weight to it. the grey one is colorful and cute. the only problem is the bagginess of the arms -- very unflattering. if i push the sleeves up, it hides the bagginess a little, but i would like to have the option to wear the dress with long sleeves., s",4,1,2,General,Dresses,Dresses
1104,35,Great fit,I purchased this dress because i have a similar one with a linen skirt from the spring. the skirt on this dress is a heavier fabric and it lays very nicely. the top provides good coverage for my larger chest and i took my typical xs size. i would definitely recommend this purchase.,5,1,0,General,Dresses,Dresses
984,58,Comfortable and great looking,"This jacket looked so good and felt so comfortable on- i almost didn't send back the first one that arrived with a little bit of damage at the bottom of the inner zippered sweatshirt, but i did exchange it and am just as happy with the fit and feel of the second one. it hangs well no matter how you fasten the front, or leave it open. great looking, casual but stylish and neat. a good grey, and a good blue.",5,1,6,General,Jackets,Jackets
1078,53,Love this dress!,"I went to my local store and they only had the blue dress in stock, i had seen it online and i didn't expect to like the blue one. i tried it on anyway, and it was adorable! i struggled to choose, but i ordered the gray one at the store and they shipped it directly to me. it arrived quickly and i love it!",5,1,2,General,Dresses,Dresses
984,64,Great jacket!,"This jacket has a nautical look which is a refreshing change for this year. it is double breasted & a stretchy cotton, which i love. i am a big fan of cotton. it appealed to me so much that i ordered both the white & the navy in the regular size small. i am of small build at 5'3"", 117# & expected that the sleeves c/b a little long. i avoid ordering petite size jackets b/c sometimes they are snug in the shoulders. ok, so the regular s was a good length at the bottom of my hips, but arms were bagg",5,1,32,General,Jackets,Jackets
850,44,Feminine and pretty,This top is gorgeous and versatile. i wear it with jeans and dress it up with a skirt. so happy to have this in my wardrobe.,5,1,0,General,Tops,Blouses
1078,49,,"I loved this dress when i saw it. however the fit was way off. i am 5'7"" 120 lbs and the small was way too big from the waist down. when the xs arrived i was sure it would be perfect. unfortunately the waist hit way too high, above my rib cage and the dress was too short. it was as if it was a petite size. i was very disappointed as this is such a pretty, easy dress to just throw on for school. unfortunately neither size looked right on me and i had to return both. the material is also not the s",2,1,0,General,Dresses,Dresses
984,52,,"The jacket is great, the quality is very good and the fit too, the best part is how it looks !",5,1,0,General,Jackets,Jackets
850,56,Runs large through the chest...,"So pretty, but does run large. i am an 8-10 , got the 8 and big through the chest. had to return for this reason. if you are on the busty side it will look fab on you.",4,1,0,General,Tops,Blouses
1078,45,,,5,1,0,General,Dresses,Dresses
984,35,Love! my new favorite jacket!,"I was looking for a stylish spring/fall jacket and this one seemed to fit the bill. i was shocked by the quality and softness of the material and construction of this jacket. i could honestly not believe how comfortable and cute this felt and looked on me. i can't wear it enough! i am a short 5'2"" but 36d and have 31"" waist so i ordered a size m and l to see which would work best. as it turned out the m fit with plenty of room! i am normally a 12/14 so i was surprised by this. if you are on the",5,1,0,General,Jackets,Jackets
831,38,Lovely blouse!,"Love the detail and the way it hangs. i sometimes struggle with blousy tops because i have a larger chest, but this one didn't make me look pregnant! i purchased this with the 30% off... i wouldn't have paid full price for it.",4,1,0,General,Tops,Blouses
1086,32,Love the lace detail,I really wanted this to work. for me the arm cutout was too wide. a cap or lace flutter sleeve would've worked . also expected a little more length felt like the petite length.,4,1,0,General,Dresses,Dresses
1044,39,,"I just received these pants and i am very pleased.  they are a little longer than i expected them to be, but that actually works out well because now i can wear them to the office.",5,1,0,General Petite,Bottoms,Pants
820,32,Cute,"Cute and pretty, runs a little wide and short, just slightly. i feel like i have that issue with all retailer clothes though. love the back.",4,1,0,General,Tops,Blouses
1094,35,Gorgeous dress,"I was hoping this would go on sale and now it finally has! i loved this dress just as much in person as i have online. the fabric is interesting-it looks almost plastic in the online pictures but don't be fooled, it is still a comfortable fabric. it is almost like lots of diamond pieces were actually sewn together to make this dress and i love it. there is a sipper down the side to make it easier to get into, but also in the back there is bunched up fabric which is made to be ore bendable for th",5,1,2,General,Dresses,Dresses
1094,34,A must buy!!,"I tried this dress on and felt amazing in it.  i got home and showed my husband my purchases.  i told him i wasn't sure if i should have bought this one and told him to be honest with me.  he said it looked great and he was glad i bought it.  so great for a spring wedding. fits true to size.  i am 125 5'4"" c-cup and i bought my normal size 0.  this made my waist look really small.",5,1,0,General,Dresses,Dresses
995,48,,,5,1,0,General,Bottoms,Skirts
1094,36,Prety dress that fits true to size,"Wow the mixed reviews on this dress would make someone not get it at all.
it is true to size. i'm a 6 and the six fit as a glove on me.
the material is not at all stiff. i actually wished it was a bit more structured. but that didn't bother me.
i was able to close the zipper by myself.
i'm 5'7"" 144lb 36a.
the top feels confortable to me as well. i don't considered myself curve like jlo but i have hips. the dress does not make me feel bigger at all.
the only down side is that it looks more expens",4,1,1,General,Dresses,Dresses
1060,40,"Very nice, just as pictured","This is a very nice jumpsuit; reviewers were correct stating that torso is long & fit better a taller person. as soon as i read the reviews i went on and placed an order for size 8, i'm 6ft tall 160lb and it has been very difficult to find a jumpsuit to fit my long torso. this one however turned out to be perfect! true to size and fit, not only that, the fabric is very soft and good quality, very interesting style of the jumpsuit, looks much better in person! i particularly liked cropped, wide-l",5,1,0,General,Bottoms,Pants
1037,41,Glad i took a chance on these!,"A nice alternative to jeans, good fit. i like the casual but edgy rocker look they have. will look good with booties and full length boots. i took the same size that i do in all pilcro pants.",4,1,0,General Petite,Bottoms,Jeans
875,33,Adorable top!!,"I love , love this top !! it looks just like the picture on model. the front is a soft t-shirt and the back is so cute and flattering . super unique and comfortable style.!! i am 5'4 -105 and xs fits perfect.",5,1,2,General,Tops,Knits
875,33,Cute top!,"This is a very cute and unique top!! i absolutely love the back, which makes up for my indifference of the front. i'm a little heavier in the middle, so it hides it a bit, but the light blue from the back that shows on the sides makes me feel a little wider. it's not perfect, but i like it enough to keep it. i got lots of compliments on it when i wore it. it's very comfortable too. i just wish the front had a little more to it or was a tad longer. overall very happy.",4,1,3,General,Tops,Knits
820,39,Love,"This top is so lovely, i was worried of the color on my pale skin, but it is complementary, nice warm tones. yes, it is a tank, but i can see this as a transition piece into fall with a nice blazer, jeans, boots... the xs regular is perfect for me, length is adequate. if i were to go with petite, i might think it is too short. it is flowy, but still has shape, more than a swing top, so very flattering. the back is really cute too, definitely need a strapless for me, due to the thin straps...",5,1,3,General,Tops,Blouses
1037,54,Comfortable and unique,"Great pants, like the edginess of the design in the material. kinda rocker like. soft material that's stretchy and hopefully will hold its shape during the day. the color is listed as black but it's more of a dark gray with a slight blue hint.",4,1,4,General Petite,Bottoms,Jeans
820,44,,,4,1,0,General,Tops,Blouses
1037,39,,"I love these! they are a perfect addition to my fall wardrobe, and just like all other pilcro jeans, they are a great fit and true to size.",5,1,0,General,Bottoms,Jeans
820,24,Fits so well!,"I often have a hard time finding items that fit true to size, but this top fits perfectly. it is cut really well and very flattering.",5,1,0,General,Tops,Blouses
1094,64,Stunning special occasion dress,"I'm surprised i'm the first to review this dress! it is a must for the holidays and any special occasion! it is absolutely gorgeous! it is so feminine and seductive; it's one of those dresses that would be stunning on anyone! it is a quality dress, beautifully made, looks just like the photo. i'm 5'9"" & the hemline falls at the top of my knees. the neckline is exquisite & really ""makes"" the dress. i purchased the black version but if i was younger i'd get it in red as it would garner quite a bit",5,1,30,General,Dresses,Dresses
833,40,Love this shirt,"This shirt is very nice quality and looks stunning. it does run tight in the shoulder area and is a bit of a challenge getting off, but as long as i don't rip it one of these times all will be well! it looks so nice on that i overlook that design flaw.",5,1,1,General,Tops,Blouses
995,39,"Comfortable, soft",The material is very soft and it looks just like it does on the model with the exception that it gets a little wrinkly at the hem and turns up at the corners. i like it and have already worn it a few times.,4,1,0,General,Bottoms,Skirts
1094,48,Cute outfit,"I love the color and the style, however it doesn't look as well as the model as i don't have a small waist like the model does. still overall, i love this dress and it is well made and comfortable",4,1,2,General,Dresses,Dresses
835,66,So good,"Love this blouse! its so darn cute. the fabric is soft, flows nicely and is just absolutely stunning without being over the top. it falls at the lower part of my hip. the softness of the fabric would make this easy to tuck in. the body of the shirt, sleeves, cuffs and placket are contrasting florals in black and creamy white. the top part is a brownish burgundy color and the flowers/butterflies are embroidered in goldenrod yellow, peach, creamy white, two mauve tones, turquoise and brown. the li",5,1,2,General,Tops,Blouses
1094,25,Love this dress,"I am 5'3"" 130 and curvy and this dress fit me perfectly. it's great for parties and weddings (depending on how formal). the only reason i gave it four stars is because the fabric is a little strange; the ribbing for the squares is almost like a pillowy fabric, and it feels a little bit on the cheaper side but luckily it doesn't look cheap. nonetheless, i love this dress and would definitely recommend!",4,1,0,General,Dresses,Dresses
1094,36,Classy little dress,"Love this dress! just wore it last night to an early valentine's dinner. very classy, simple, but gorgeous. i'm a size 2 in just about everything but i always buy a size 4 in retailer dresses because i'm tall (5'9"") and have broad shoulders and a long torso, and sizing up in dresses works better all around. i am also not busty (32b). i did get this in a 4. this dress was a little awkward at first trying to hook and then zip but once i got that down it worked. the hook is right up under your",4,1,0,General,Dresses,Dresses
823,37,,"This is a beautiful top. it extended longer than i had hoped and a petite size was not available, so i ended up returning it. but it is beautiful and the tassels on the sides make it truly unique.",5,1,1,General,Tops,Blouses
835,42,Unique piece / boho chic,"Love this blouse! i took a chance on ordering it and wasn't sure what i would think. this blouse is fabulous!!! it has a boho-chic flair to it in a sophisticated way. it's one of those ""special"" pieces from retailer; elegant, quirky, sophisticated.
the details are great, too. of course the embroidery is beautiful; but there are a couple more fun details. the cuffs on the sleeve have multiple buttons; so that you can button them tight or just enough to roll the cuff once. when the cuff is r",5,1,1,General,Tops,Blouses
833,26,My favorite black top.,"This is a timeless top. i loved the overall look of the top and after eyeing it for several days decided to purchase it. warning, the shoulder area is cut small due to the fabric at the top. i am usually a size 12 (because of ddd chest) but i bumped up to a 14 and it was perfect.",4,1,1,General,Tops,Blouses
833,33,Super flattering,Love this top! it is super flattering with a long floaty body. i usually wear a 4 but sized up to a 6 due to the reviews and am happy with it but think a 4 would have fit as well.,5,1,2,General,Tops,Blouses
820,52,Pretty tank,Love tanks and this one is sweet and flowy. great with jeans/shorts or slacks with a jacket for the office. beautiful yellow floral with fun straps in the back that you can wear with a bra. front neckline is cut narrow so bra straps show but with nude or plastic straps it's not that big a deal.,5,1,0,General,Tops,Blouses
835,41,Different than the rest !!!,"This is truly unique top, the  detail around the neck is a nice change!!!",5,1,0,General,Tops,Blouses
1060,25,Slimmingly perfect!,"I am 5'2"" 125 pounds and i bought the 4p. the fabric is high quality and does not cling at all but instead drapes and in a very flattering way. add that to the cut of this jumpsuit and you have elongating, very flattering lines. i could not be more pleased and regret not having bought this item earlier, since i would have enjoyed wearing it during the holidays. as other reviewers said, it is adorable and a winner.",5,1,0,General,Bottoms,Pants
1037,47,Too bad!,Very nice fabric but disappointed in the stitching on the knees. it looks nice but makes the pants very uncomfortable and tight around the knees. too bad because i love the style and hoped they would work!,3,1,0,General,Bottoms,Jeans
820,24,"Very cute, snug fit","Very cute flowy fit. i am generally a size small, 32-d chest. because the material has no give it fits perfectly (just barely) if it was any smaller or i was any larger it would be too small. very cute design.",4,1,0,General,Tops,Blouses
1094,48,Cute outfit,"I love the color and the style, however it doesn't look as well as the model as i don't have a small waist like the model does. still overall, i love this dress and it is well made and comfortable",4,1,2,General,Dresses,Dresses
835,66,So good,"Love this blouse! its so darn cute. the fabric is soft, flows nicely and is just absolutely stunning without being over the top. it falls at the lower part of my hip. the softness of the fabric would make this easy to tuck in. the body of the shirt, sleeves, cuffs and placket are contrasting florals in black and creamy white. the top part is a brownish burgundy color and the flowers/butterflies are embroidered in goldenrod yellow, peach, creamy white, two mauve tones, turquoise and brown. the li",5,1,2,General,Tops,Blouses
1094,25,Love this dress,"I am 5'3"" 130 and curvy and this dress fit me perfectly. it's great for parties and weddings (depending on how formal). the only reason i gave it four stars is because the fabric is a little strange; the ribbing for the squares is almost like a pillowy fabric, and it feels a little bit on the cheaper side but luckily it doesn't look cheap. nonetheless, i love this dress and would definitely recommend!",4,1,0,General,Dresses,Dresses
