Clothing ID,Age,Title,Review Text,Rating,Recommended IND,Positive Feedback Count,Division Name,Department Name,Class Name
767,33,,Absolutely wonderful - silky and sexy and comfortable,4,1,0,Initmates,Intimate,Intimates
1080,34,,"Love this dress!  it's sooo pretty.  i happened to find it in a store, and i'm glad i did bc i never would have ordered it online bc it's petite.  i bought a petite and am 5'8"".  i love the length on me- hits just a little below the knee.  would definitely be a true midi on someone who is truly petite.",5,1,4,General,Dresses,Dresses
1049,50,My favorite buy!,"I love, love, love this jumpsuit. it's fun, flirty, and fabulous! every time i wear it, i get nothing but great compliments!",5,1,0,General Petite,Bottoms,Pants
847,47,Flattering shirt,This shirt is very flattering to all due to the adjustable front tie. it is the perfect length to wear with leggings and it is sleeveless so it pairs well with any cardigan. love this shirt!!!,5,1,6,General,Tops,Blouses
858,39,Cagrcoal shimmer fun,"I aded this in my basket at hte last mintue to see what it would look like in person. (store pick up). i went with teh darkler color only because i am so pale :-) hte color is really gorgeous, and turns out it mathced everythiing i was trying on with it prefectly. it is a little baggy on me and hte xs is hte msallet size (bummer, no petite). i decided to jkeep it though, because as i said, it matvehd everything. my ejans, pants, and the 3 skirts i waas trying on (of which i ]kept all ) oops.",5,1,1,General Petite,Tops,Knits
858,39,"Shimmer, surprisingly goes with lots","I ordered this in carbon for store pick up, and had a ton of stuff (as always) to try on and used this top to pair (skirts and pants). everything went with it. the color is really nice charcoal with shimmer, and went well with pencil skirts, flare pants, etc. my only compaint is it is a bit big, sleeves are long and it doesn't go in petite. also a bit loose for me, but no xxs... so i kept it and wil ldecide later since the light color is already sold out in hte smallest size...",4,1,4,General Petite,Tops,Knits
1077,24,Flattering,I love this dress. i usually get an xs but it runs a little snug in bust so i ordered up a size. very flattering and feminine with the usual retailer flair for style.,5,1,0,General,Dresses,Dresses
1077,34,Such a fun dress!,"I'm 5""5' and 125 lbs. i ordered the s petite to make sure the length wasn't too long. i typically wear an xs regular in retailer dresses. if you're less busty (34b cup or smaller), a s petite will fit you perfectly (snug, but not tight). i love that i could dress it up for a party, or down for work. i love that the tulle is longer then the fabric underneath.",5,1,0,General,Dresses,Dresses
1095,39,,This dress is perfection! so pretty and flattering.,5,1,2,General Petite,Dresses,Dresses
1095,53,Perfect!!!,"More and more i find myself reliant on the reviews written by savvy shoppers before me and for the most past, they are right on in their estimation of the product. in the case of this dress-if it had not been for the reveiws-i doubt i would have even tried this. the dress is beautifully made, lined and reminiscent of the old retailer quality. it is lined in the solid periwinkle-colored fabric that matches the outer fabric print. tts and very form-fitting. falls just above the knee and does not rid",5,1,2,General Petite,Dresses,Dresses
767,44,Runs big,"Bought the black xs to go under the larkspur midi dress because they didn't bother lining the skirt portion (grrrrrrrrrrr).
my stats are 34a-28/29-36 and the xs fit very smoothly around the chest and was flowy around my lower half, so i would say it's running big.
the straps are very pretty and it could easily be nightwear too.
i'm 5'6"" and it came to just below my knees.",5,1,0,Initmates,Intimate,Intimates
1077,50,Pretty party dress with some issues,This is a nice choice for holiday gatherings. i like that the length grazes the knee so it is conservative enough for office related gatherings. the size small fit me well - i am usually a size 2/4 with a small bust. in my opinion it runs small and those with larger busts will definitely have to size up (but then perhaps the waist will be too big). the problem with this dress is the quality. the fabrics are terrible. the delicate netting type fabric on the top layer of skirt got stuck in the zip,3,1,1,General,Dresses,Dresses
1065,47,"Nice, but not for my body","I took these out of the package and wanted them to fit so badly, but i could tell before i put them on that they wouldn't. these are for an hour-glass figure. i am more straight up and down. the waist was way too small for my body shape and even if i sized up, i could tell they would still be tight in the waist and too roomy in the hips - for me. that said, they are really nice. sturdy, linen-like fabric, pretty color, well made. i hope they make someone very happy!",4,1,3,General,Bottoms,Pants
1065,34,"You need to be at least average height, or taller","Material and color is nice.  the leg opening is very large.  i am 5'1 (100#) and the length hits me right above my ankle.  with a leg opening the size of my waist and hem line above my ankle, and front pleats to make me fluffy, i think you can imagine that it is not a flattering look.  if you are at least average height or taller, this may look good on you.",3,1,2,General,Bottoms,Pants
853,41,Looks great with white pants,Took a chance on this blouse and so glad i did. i wasn't crazy about how the blouse is photographed on the model. i paired it whit white pants and it worked perfectly. crisp and clean is how i would describe it. launders well. fits great. drape is perfect. wear tucked in or out - can't go wrong.,5,1,0,General,Tops,Blouses
1120,32,Super cute and cozy,"A flattering, super cozy coat.  will work well for cold, dry days and will look good with jeans or a dressier outfit.  i am 5' 5'', about 135 and the small fits great.",5,1,0,General,Jackets,Outerwear
1077,47,Stylish and comfortable,"I love the look and feel of this tulle dress. i was looking for something different, but not over the top for new year's eve. i'm small chested and the top of this dress is form fitting for a flattering look. once i steamed the tulle, it was perfect! i ordered an xsp. length was perfect too.",5,1,0,General,Dresses,Dresses
847,33,"Cute, crisp shirt","If this product was in petite, i would get the petite. the regular is a little long on me but a tailor can do a simple fix on that. 

fits nicely! i'm 5'4, 130lb and pregnant so i bough t medium to grow into. 

the tie can be front or back so provides for some nice flexibility on form fitting.",4,1,2,General,Tops,Blouses
1080,55,I'm torn!,"I'm upset because for the price of the dress, i thought it was embroidered! no, that is a print on the fabric. i think i cried a little when i opened the box. it is still ver pretty. i would say it is true to size, it is a tad bit big on me, but i am very tiny, but i can still get away with it. the color is vibrant. the style is unique. skirt portion is pretty poofy. i keep going back and forth on it mainly because of the price, although the quality is definitely there. except i wish it were emb",4,1,14,General,Dresses,Dresses
1077,34,"Like it, but don't love it.","Cute little dress fits tts. it is a little high waisted. good length for my 5'9 height. i like the dress, i'm just not in love with it. i dont think it looks or feels cheap. it appears just as pictured.",3,1,0,General,Dresses,Dresses
847,55,Versatile,"I love this shirt because when i first saw it, i wasn't sure if it was a shirt or dress. since it is see-through if you wear it like a dress you will need a slip or wear it with leggings. i bought a slip, wore the tie in the back, and rocked it with white wedges. you could also wear it as a vest. be careful with the buttons. i haven't had any fall off yet, but i feel like they will. overall it's great for any occasion and it's fun to wear!",5,1,0,General,Tops,Blouses
1003,31,"Loved, but returned","The colors weren't what i expected either. the dark blue is much more vibrant and i just couldn't find anything to really go with it. fabric is thick and good quality. has nice weight and movement to it. the skirt just wasn't for me, in the end.",4,1,0,General,Bottoms,Skirts
684,53,Great shirt!!!,I have several of goodhyouman shirts and i get so many compliments on them. especially the one that says forehead kisses are underrated. don't hesitate. buy this shirt. you won't be sorry.....,5,1,2,Initmates,Intimate,Lounge
4,28,Great layering piece,"This sweater is so comfy and classic - it balances a quirky hand-knit look with a beautiful color and practical fit. it is a bit cropped and boxy as part of the style, and as others mentioned, there are gaps in the knit that make it see-through. in my opinion this makes it perfect for layering! i like having a longer camisole showing underneath, or wearing it over a little dress. it's warm but still thin enough to fit under a jacket or coat.",5,1,0,General,Tops,Sweaters
1060,33,,Beautifully made pants and on trend with the flared crop. so much cuter in person. love these!,5,1,0,General Petite,Bottoms,Pants
1060,46,Cuter in oerson!,"I never would have given these pants a second look online, in person they are much cuter! the stripes are brighter and the fit more flattering. the crop has a cute flare which is right on trend. this brand has always run small for me, i am 5'8 about 140lbs and carry some chubbiness in the belly. i paired it with a collarless loose navy blazer",5,1,7,General Petite,Bottoms,Pants
1060,21,Love these pants,These pants are even better in person. the only downside is that they need to be dry cleaned.,5,1,0,General Petite,Bottoms,Pants
697,39,Love this dress!,"This is such a neat dress. the color is great and the fabric is super soft. i am tall so the long length was an added bonus. it definitely needs something underneath since the front gaps. i am going to pair it with a funky tank top, necklaces and boots. super cute!!",5,1,0,Initmates,Intimate,Lounge
1060,65,Lovely!,"Wouldn't have given them a second look but tried them on in store of a whim. love, love!!",4,1,3,General Petite,Bottoms,Pants
1002,29,,"This is a comfortable skirt that can span seasons easily. while not the most exciting design, it is a good work skirt that can be paired with many tops.",4,1,5,General,Bottoms,Skirts
949,38,Beautifully cut lightweight coat,"Just ordered this in a small for me (5'6"", 135, size 4) and medium for my mom (5'3"", 130, size 8) and it is gorgeous - beautifully draped, all the weight/warmth i'll need for houston fall and winter, looks polished snapped or unsnapped. age-appropriate for both my mom (60's) and myself (30's). will look amazing with skinny jeans or leggings. we ordered the gray which is true to the photos.",5,1,1,General,Tops,Sweaters
684,36,,Super cute and comfy pull over. sizing is accurate. material has a little bit of stretch.,5,1,2,Initmates,Intimate,Lounge
862,59,,Great casual top with flare. looks cute with grey pilcro stet jeans. flattering with peplum in back. nice cut for shoulders and neckline.,5,1,0,General,Tops,Knits
862,47,,"Pretty and unique. great with jeans or i have worn it to work with slacks and heels. the colors, print, and embroidery are lovely. reasonably priced!",4,1,1,General,Tops,Knits
862,40,,"This is a beautiful top. it's unique and not so ordinary. i bought my usual medium and i found that it fits tight across my chest. although i had a baby this year and i am nursing, so that could be why. if i bought again i would size up.",5,1,0,General,Tops,Knits
910,23,Soft & lovely,"This poncho is so cute i love the plaid check design, the colors look like sorbet & cream and it will pair well with a turtleneck and jeans or pencil skirt and heels. i love this look for fall and it can roll right into spring. great buy!!",5,1,0,General,Tops,Fine gauge
89,67,Some things you should know...,"First, this is thermal ,so naturally i didn't expect super sheer, but it is. really sheer light fabric. i like it, but be prepared for considering who you might run into if you walk around the house in it. second, it is large. i ordered the size 0 and it's a nice oversized fit for my 5'3"" 125 pounds. i wouldn't want to go larger. along with being sheer, the fabric is easily stretched, which i don't mind in this case. finally, the color. it looks white on my monitor and shows a colorful blue dot",4,1,1,Initmates,Intimate,Sleep
862,48,Beautiful!,"Tried this on today at my local retailer and had to have it. it is so comfortable and flattering. it's too bad the picture online has the model tucking it into the skirt because you can't see the ruching across the front. a little dressier alternative to a plain tee and reasonably priced for retailer. 5'8"""" and i generally wear a 6, the small fit well. will probably be back for the black!",5,1,9,General,Tops,Knits
862,43,Love the two tone design,I bought this item from online... the fit on the model looked a little loose but when i got mine it seemed a bit tight! so i took it back to the store & ordered a larger size. for the sale price this is a great top.,4,1,0,General,Tops,Knits
862,40,,I love this top. i wear it all the time.  the problem is that you can tell i wear it all the time as the fabric has started to fade.  i'd still recommend it as it is so comfortable.,5,1,0,General,Tops,Knits
823,52,,"Very comfortable, material is good, cut out on sleeves flattering",5,1,0,General,Tops,Blouses
910,56,Love the color!,"This sweater is perfect for fall...it's roomy, warm, super comfy and the color really pops.",5,1,0,General,Tops,Fine gauge
862,33,Love the embroidery!,"Really cute top! the embroidery on the collar & bib of this top is beautiful and unique, received lots of compliments & questions about where i got it. i'm rather busty up top and the medium fit well, a small probably would've fit better but it's still super adorable.",5,1,0,General,Tops,Knits
862,46,Cute for fall,"This is a cute top that can transition easily from summer to fall. it fits well, nice print and it's comfortable. i tried this on in the store, but did not purchase it because the color washed me out. this is not the best color for a blonde. would look much better on a brunette. if this was in a different color i most likely would have purchased it.",4,1,1,General,Tops,Knits
862,41,Love,"I absolutely love this bib tee! it's probably my favorite retailer purchase of all time. i'm 5'7"", 140 pounds and the small was a perfect fit for me. i typically wear either a s or m tops.",5,1,2,General,Tops,Knits
1104,39,,"Love the color and style, but material snags easily",3,1,3,General,Dresses,Dresses
862,39,Flattering and comfortable,"Very soft and comfortable. the shirt has an unusual, asymmetrical seam that appears along the front, right-hand side of the garment. (the model is positioned so that you can't see this detail from the picture. i attached a picture that includes the front seam.) i actually like the seam - it creates more visual interest, and adds a little bit of ruching that helps hide my belly. the cowl neck is very well done - there are two layers that form the cowl, and i've found that it means wardrobe malfun",5,1,34,General,Tops,Knits
862,66,Cute top,"Nice top. armholes are a bit oversized but as an older woman, i'm picky about that. the print is pretty and unusual. it just didn't look great on me. there's a slight peplum in the back that hangs nicely. it's a lightweight tee fabric that's opaque. i tried it on with a black bra which was barely visible. great for warmer climates but there are so many gorgeous tops out now, that i decided to return since summer is winding down. i do recommend.",4,1,2,General,Tops,Knits
862,61,Soft and cute as can be!,This is an adorable top that i find to be extremely comfortable. i don't usually buy prints but this one is so feminine and looks great with dark wash jeans. i am a 36d and the medium was a perfect fit.,5,1,2,General,Tops,Knits
1095,36,,"I got this in the petite length, size o, and it fit just right. i like that i didn't have to have it altered in the length; can wear with flats with plenty of clearance to the floor from the bottom hem. my only beef with the design is the height of the waist. i personally think that the elastic waistband looks cheap, and really needs to be concealed with a belt, yet because it sits so high, literally right under the bustline, it's a tricky one to pull off. i have a wide belt that sort of does th",4,1,0,General Petite,Dresses,Dresses
368,52,Soft and comfortable,"I've been looking for bralettes that provide some support but not binding/tight for night time and casual wear. this is a light weight bra, could be a little more supportive. pretty color, with nice lines. only downside is the retailer tag on the back - itchy (i need to remove it.)",4,1,1,Initmates,Intimate,Intimates
1095,41,Gorgeous dress!,"This dress is simply beautiful and stunning. it is so figure flattering and i can't wait to wear it. size small worked for me, and since i'm tall it fell right to my ankle which is perfect for me. i could not be happier with the purchase and the keyhole in the back is a beautiful detail.",5,1,0,General Petite,Dresses,Dresses
862,28,Must have,I recently got this on sale after looking at it forever on my wish list. i'm so happy with it. its very comfortable and just long enough for my torso (5'3). the pattern on the front is very flattering.,5,1,0,General,Tops,Knits
862,57,Cute top! love the brand,"Very comfortable shirt, light weight top with lovely floral colors. great for spring/summer with white jeans. love everything one september makes!",5,1,1,General,Tops,Knits
862,43,Love this top,Loved this top and was really happy to find it on sale!,5,1,0,General,Tops,Knits
862,58,,"Beautiful top, but delicate! i wore it to school and the straps on my backpack caused some pilling. other than that it is beautiful and vibrant! just make sure you aren't doing/wearing anything that will rub it continuously since the fabric is delicate",4,1,2,General,Tops,Knits
862,60,Super cute and unique top,"Just received this in the mail, tried it on and am smitten. i'm usually a l, but sometimes i'm a xl (if no stretch), in retailer tops. i bought this one in l and i'm sure glad i did. very flowy, stretchy and comfortable. i also bought the meda lace top from one september and they are very similar expect this is more of a t-shirt and the other is more of a blouse. i almost think i could've gotten a m in this because there is a lot of extra fabric at the chest which is usually never the issue for me",4,1,9,General,Tops,Knits
862,40,Beautiful top,"Love this top! i kept eyeing it online and wavering on size, since my post-baby body is a little wonky. i went with the xsp, and miraculously, it works perfectly! so, i would say it does run just a little large..... i love the length, and usually do not go with petite sizes at retailer because i like the longer lengths of the regular. but this is perfect on me, and there is give up top, so it looks lovely. and it is very soft and comfortable. this will be a go-to top this season!",5,1,1,General,Tops,Knits
845,38,"Cute, but massive sweep","This top is so cute, but it is massively babydoll shaped (a- line) which is not apparent from the pictures. i measured the xs i have and the chest is about 42"" and sweep is over 70"". i would definitely keep this top if it hung straighter. the craftsmanship is lovely and fabric is so natural and handwoven looking. i'm thinking about asking my tailor if she can take the sides in, but that might ruin it as the fabric layout is cut and proportioned to this swing style.",4,1,10,General Petite,Tops,Blouses
850,27,Beautiful design,"I have a short torso and this works well for me. 34c, bought the 0. there's not much stretch to the fabric so it is fitted to my chest, but not in an uncomfortable way. definitely doesn't hang and have extra fabric like on the model. 

zipper goes almost all the way down to the bottom so it's easier to get on and off which makes up for the lack of stretch n the fabric.

unlike another reviewer, i found it went really well with navy pants and i wore it to a business meeting under a blazer. wi",5,1,4,General,Tops,Blouses
866,47,,"I love this top. it is loose and comfortable. it is not sheer so you don't need a cami. it runs a little large so size down if you want a more tailored fit. 1 criticism, it catches on sharp jewelry or belts and can pull if you are not careful.",4,1,0,General Petite,Tops,Knits
1081,59,,I passed up this dress so many times in the store and finally tried it on today because i wanted a casual dress while traveling in the cape. i was surprised how much cuter it is on than on hanger. i sized down to get a more fitting look and really made a difference for me in style. i was not a fan of the way it looked so loose on model. it looks really cute fitted and a bit sexy even. it is lined and very comfy and can be dressed up a but for work with a cardi. i believe i will get a lot of wear,5,1,1,General Petite,Dresses,Dresses
845,48,Very very cute but a lot of fabric,"I am so drawn to baby doll and boxy shirts so i immediately tried this on in the store. i am petite and only 5'2"", so usually shirts with a lot of fabric swallow me whole but this one was still cute. there is a lot more fabric than the picture lets on, but i think it is still super cute and flattering. i would definitely check the size chart and read comments to see if someone with your same size description has recommended a specific size for your body type. i am petite and weigh about 110 lbs",5,1,5,General Petite,Tops,Blouses
1082,31,Runs large in top and waist,"I would have loved this dress if the bust and waist were just a little more fitted. i am 32c and the top was too big. fit perfectly on hips. the lace material means it cannot be easily altered, so i chose to return the dress. i would have definitely kept it if it were a better fit.",4,1,0,General,Dresses,Dresses
836,47,Obsessed,I usually size up with this brand. small was perfect for me at 135lbs. this top has a luxurious but casual feel and beautiful. i am obsessed and want to wear it everyday. it wears a little long and drapey but a little tight where it rolls up in the arms.,5,1,1,General,Tops,Blouses
1081,62,So cute...but dry clean?!,"This dress is adorable - it's a perfect casual look for summer and the quality is nice with the lining (though still overpriced, in my opinion). the tie detail is somewhat adjustable, and i found my normal size s to fit fine (5'7, 128#). where this gets me is the fact that it's dry clean...totally doesn't make sense for a dress that is essentially a fancy tshirt for summer. i might bring it back for that alone, since i originally planned to wear it a lot. :(",4,1,2,General Petite,Dresses,Dresses
1072,68,Elegant classic dress,"I am usually a petite 6 but since this dress did not come in petites i tried on 4 and it fit. i'm 5'1"" -112lbs so dress hit rt below knee -will have it hemmed up a bit do not so overwhelming.

this dress looks stunning on! great vibrant color ( i have dark hair) makes this classic elegant dress look contemporary and stylish. when i tried it on in store, salesperson and others who happen to see it on me raved and told me to grab it! i did and am glad.

i plan to wear it this spring for my daughte",5,1,1,General,Dresses,Dresses
863,61,,Loved this top. great design. comfortable and unique. soft material,5,1,4,General Petite,Tops,Knits
1133,33,Cute parka!,"The rest of the reviewers are right about the color being in accurately pictured. i ordered the dark orange color and i recieved more of a dark cedar brown colored jacket. the print is great, i love it! it's so different than any other jackets ive seen. while the jacket is C#B<ber cute, it is a bit bulky (though the waist tie helps with that) and its not heavy winter appropriate ( it's not waterproof or heavily insulated). for your average winter day though, it will be a fun option! the removable v",5,1,0,General,Jackets,Outerwear
822,68,Just lovely,"I purchased this top in an antro store last week. the quality is wonderful and the greenish blue color is very unique. the blouse has a beautiful stretchy camsiole that is attached at the shoulders, but can be removed by snaps. i tooks great when worn two different ways. i wore it with the campole out, and it peeks through the blouse at the bottom. it also looks great when the camisole is worn in. my only wish is that it would come in a petite size as it's a touch big at the shoulders and neckli",5,1,3,General,Tops,Blouses
861,37,Casual & unique tee,"I received this shirt in my typical xs and it fits perfectly. i?m not crazy in love with it but i also don?t dislike. the shirt is on the thin side. do i need to wear a cami underneath it, no. my concern is holes. it does remind me of a material that could develop some holes after some wear and washes. with that being said i?ll wash this shirt in cold water and hang dry and hopefully that will prevent holes from developing. the length is fine and i do like the slits in front?it adds a little dim",3,1,0,General Petite,Tops,Knits
850,39,Neutral blue,"I tried this on from the sale section, and they only had a 2 (i usually do 0), and surprisingly, that size was the right fit. it is fitted, with just enough room to eat :-) 
te blue is a light blue, almost neutral, with the white embroidery, i think it looked stylish, and decided to keep it. the peplum part hit just in the right spot, i am short (petite) but my torso is normal size...",4,1,0,General Petite,Tops,Blouses
